KOD;NAIM;
0300200003;Строковые значения должны быть в верхнем регистре;
0300200004;Строка RRR не должна содержать двоеточие;
0300200005;Строка имеет неправильную структуру, необходимо KKK разделителей SSS;
0300200006;Значение не может иметь начальных и конечных пробелов;
0300200007;Ошибка в формате реквизита служебной части. Пропущен символ двоеточие;
0300200008;Строка RRR не должна содержать двоеточие;
0300200009;Отсутствует открывающий (закрывающий) тег;
0300300000;Структура файла обмена не соответствует требованиям формата;
0300300001;Файл не соответствует xsd-схеме;
0300300002;Недопустимая строка RRR;
0300300003;Недопустимый реквизит VVV;
0300300004;Должен быть реквизит VVV;
0300300005;Должен быть один из реквизитов VVV;
0300300006;Недопустимый тег VVV;
0300300007;Нет тега VVV;
0300300008;Должен быть тег VVV;
0300300009;Должен быть один из тегов VVV;
0300300010;Нет обязательного атрибута VVV;
0300300011;Недопустимый атрибут VVV;
0300300012;Отсутствие в налоговой декларации (расчете) фамилии, имени, отчества налогоплательщика (для физического лица);
0300300013;Отсутствие в налоговой декларации (расчете) полного наименования организации (ее обособленного подразделения), налогоплательщика (для организации);
0300300014;Отсутствие в налоговой декларации (расчете) ИНН налогоплательщика. Если иное не предусмотрено Налоговым кодексом Российской Федерации;
0300300015;Отсутствие в налоговой декларации (расчете) значения элемента Номер корректировки (Вида документа) (0 - первичный, 1-999 - корректирующий);
0300300016;Отсутствие в налоговой декларации (расчете) наименования (кода) налогового органа представления отчетности;
0300300017;Отсутствие в налоговой декларации (расчете) значения элемента Код формы отчетности по КНД;
0300300018;Отсутствие в налоговой декларации (расчете) значения элемента Версия формата;
0300300019;Неизвестный код реквизита служебной части;
0300300020;Неизвестный код реквизита документа NNNN;
0300300021;Не введен реквизит VVV служебной части файла, обязательный к заполнению;
0300300022;Не введен реквизит VVV документа NNNN файла, обязательный к заполнению;
0300300023;Отсутствие обязательного реквизита VVV;
0300300024;Несоответствие регистра в наименовании тега VVV;
0300300025;Ошибка в наименовании атрибута VVV. Не соответствие регистра;
0300300026;Ошибка идентификации строк документа. В шаблоне с кодом... (реквизит КНД) документа №... (в базе данных шаблон, УН шаблона = ...) отсутствуют коды строк электронного документа;
0300300027;Ошибка заполнения данных строки... Наименование.. Электронный код:... Строка:... Лист:.. Значение:...;
0300300028;Не идентифицирован шаблон с кодом документа...;
0300300029;XML файл пустой или имеет неправильную структуру;
0300300030;Нарушено условие присутствия (отсутствия) элемента;
0300300031;Нарушено ограничение множественности реализации элемента;
0300300032;Реквизит XXX в имени не соответствует реквизиту VVV в файле;
0300300033;Реквизит VVV в файле не соответствует реквизиту VVV в файле;
0300300034;Отсутствие в файле ИНН налогоплательщика;
0300400000;Значение элемента не соответствует определённому для него формату;
0300400001;Значение не может быть пустым;
0300400002;Значение не соответствует числовому формату;
0300400003;Значение не соответствует числовому формату без дробной части;
0300400004;Значение не соответствует числовому формату c TTT знаками в дробной части;
0300400005;Значение не соответствует дате;
0300400006;Недопустимый текст XXX;
0300400008;Нет значения тега;
0300400009;Недопустимое значение;
0300400010;Нарушение формата реквизитов (в том числе сложных). Не заполнен или неверно заполнен реквизит НомерКорр документа NNNN;
0300500000;Несоответствие диапазону возможных значений элементов файла обмена;
0300500001;Длина значения элемента меньше или равно минимально допустимому;
0300500002;Длина значения элемента меньше минимально допустимого;
0300500003;Длина значения элемента меньше минимального BBB;
0300500004;Длина значения элемента больше или равно максимально допустимому;
0300500005;Длина значения элемента больше максимально допустимого;
0300500006;Длина значения больше максимального MMM;
0300600000;Значение элемента не соответствует определённому для него шаблону;
0300700000;Значение элемента не соответствует определённого для него перечню возможных значений элементов;
0300700001;Должно быть значение тега NNN;
0300700002;Недопустимое значение. Должно быть XXX;
0300800000;Элемент файла не соответствует определённым для него требованиям;
0300800001;Значение не соответствует ИНН. Неправильная длина;
0300800002;Значение не соответствует ИНН. Недопустимый символ;
0300800003;Значение не соответствует ИНН. Неправильная контрольная сумма;
0300800004;Значение не соответствует ИНН ЮЛ. Неправильная длина;
0300800005;Значение не соответствует ИНН ЮЛ. Недопустимый символ;
0300800006;Значение не соответствует ИНН ЮЛ. Неправильная контрольная сумма;
0300800007;Значение не соответствует ИНН ФЛ. Неправильная длина;
0300800008;Значение не соответствует ИНН ФЛ. Недопустимый символ;
0300800009;Значение не соответствует ИНН ФЛ. Неправильная контрольная сумма;
0300800010;Идентификатор файла указан неправильно. Знаки с 13 по 21 не соответствуют КПП;
0300800011;Идентификатор файла указан неправильно. Знаки с 1 по 10 не соответствуют ИНН ЮЛ;
0300800012;Идентификатор файла указан неправильно. С 13 по 21 знаки должны быть *;
0300800013;Идентификатор файла указан неправильно. Знаки с 1 по 12 не соответствуют ИНН ФЛ;
0300800014;Идентификатор файла указан неправильно. Знаки с 22 по 29 не соответствуют дате;
0300800015;Идентификатор файла указан неправильно. Знаки с 30 и 31 не соответствуют часам;
0300800016;Идентификатор файла указан неправильно. Знаки 32 и 33 не соответствуют минутам;
0300800017;Идентификатор файла указан неправильно. Знаки 34 и 35 знаки не соответствуют секундам;
0300800018;Идентификатор документа указан неправильно. Знаки с 13 по 21 не соответствуют КПП;
0300800019;Идентификатор документа указан неправильно. Знаки с 1 по 10 не соответствуют ИНН ЮЛ;
0300800020;Идентификатор документа указан неправильно. С 13 по 21 знаки должны быть *;
0300800021;Идентификатор документа указан неправильно. Знаки с 1 по 12 не соответствуют ИНН ФЛ;
0300800022;Идентификатор документа указан неправильно. Знаки c 22 по 25 должны соответствовать отчетному году;
0300800023;Идентификатор документа указан неправильно. Знаки c 25 по 33 не соответствуют номеру документа в году;
0300800024;Неправильная длина ИНН;
0300800025;Недопустимый символ в ИНН;
0300800026;Неправильная контрольная сумма в ИНН;
0300800027;Неправильная длина ИНН ЮЛ;
0300800028;Недопустимый символ в ИНН ЮЛ;
0300800029;Неправильная контрольная сумма в ИНН ЮЛ;
0300800030;Неправильная длина ИНН ФЛ;
0300800031;Недопустимый символ в ИНН ФЛ;
0300800032;Неправильная контрольная сумма в ИНН ФЛ;
0300800033;Неправильная длина КПП;
0300800034;Недопустимый символ в КПП;
0300800035;Недопустимое значение. Должно быть XXX;
0300800036;Ошибка в значении атрибута VVV: неверное количество XXX 2. Должно быть XXX 3;
0300800037;Ошибка в значении: неверное количество XXX 2. Должно быть XXX 3;
0300800038;Нарушение формата реквизитов (в том числе сложных). Не заполнен или неверно заполнен реквизит ДокПредст документа NNNN;
0300800039;Нарушение формата реквизитов (в том числе сложных).  Не заполнен или неверно заполнен реквизит ОКАТО/ОКТМО документа NNNN;
0300800040;Нарушение формата реквизитов (в том числе сложных). Не заполнен или неверно заполнен реквизит ФИОРук документа NNNN;
0300800041;Значение элемента (атрибута) должно быть неотрицательным, т.е. 0 и больше 0;
0300800042;Значение элемента (атрибута) должно быть отрицательным, т.е. меньше 0;
0300800043;Значение элемента (атрибута) должно быть неположительным, т.е. 0 и меньше 0;
0300800044;Значение элемента (атрибута) должно быть положительным, т.е. больше 0;
0300800045;Недопустимое значение. XXX не может превышать дату отправки документа;
0300800046;Недопустимое значение СНИЛС. Неправильная контрольная сумма;
0300800047;Нарушение формата реквизитов (в том числе сложных). Не заполнен или неверно заполнен реквизит ОКАТО/ОКТМО;
0400000000;Ошибки, выявляемые в ходе логического контроля;
0400100000;Не идентифицирован налогоплательщик;
0400100001;Не найден плательщик по ИНН и КПП или ИНН, представленным в файле;
0400100002;Найденный плательщик снят с учета;
0400100003;Значение элемента ИдПол XXX не соответствует базе данных (проверяется значение реквизита ИдПол в соответствии с кодом НО);
0400100004;ИНН/КПП отправителя не совпадает с ИНН/КПП, которому был отправлен ТК с документами;
0400100005;ИНН/КПП налогоплательщика не соответствует ИНН/КПП в отправленном транспортном контейнере;
0400100006;ИНН/КПП абонента не совпадает с ИНН/КПП в отправленном транспортном контейнере;
0400100007;Неправильное указание сведений, несоответствие сведений о налогоплательщике - (ИНН/КПП - наименование организации, ФИО-ИНН);
0400100008;На основании сведений, представленных в файле учетные действия не могут быть выполнены;
0400100009;Не найден иностранный филиал (представительство)  по НЗА, представленному в документе;
0400100010;Налогоплательщик уже состоит на учете в указанном налоговом органе в данном качестве;
0400100011;По указанным ИНН/КПП или ИНН отсутствует постановка на учет в налоговом органе;
0400100012;Сведения по застрахованному лицу присутствуют в представленном документе более одного раза;
0400200000;Ошибки служебной части файла обмена, титульного листа отчётности;
0400200001;Неверная версия формата XXX . Ее значение должно быть равно XXX;
0400200002;Ошибка идентификации отчетного периода. Неверное значение номера отчетного периода в документе NNNN;
0400200003;Неверно задан год отчетного периода в документе NNNN;
0400200004;Отчетный период не может быть более одного года;
0400200005;Файл с признаком Вид документа (первичный, с признаком корректировки) уже зарегистрирован;
0400300000;Нарушение условия присутствия (отсутствия) элемента (атрибута);
0400300001;Нарушено условие обязательности присутствия (отсутствия) элемента (атрибута) в зависимости от присутствия (отсутствия) другого элемента (атрибута);
0400300002;Нарушено условие обязательности присутствия (отсутствия) элемента (атрибута) в зависимости от принимаемого им значения;
0400300003;Нарушено условие обязательности присутствия элемента (атрибута) в зависимости от значения другого элемента (атрибута);
0400300004;Нарушено условие выбора элемента из нескольких в зависимости от значения другого элемента (атрибута);
0400400000;Нарушение условия значения элемента (атрибута);
0400400001;Значение элемента (атрибута) должно быть не больше значения другого элемента;
0400400002;Значение элемента (атрибута) должно быть больше значения другого элемента;
0400400003;Значение элемента (атрибута) должно быть не меньше значения другого элемента;
0400400004;Значение элемента (атрибута) должно быть меньше значения другого элемента;
0400400005;Значение элемента (атрибута) не принадлежит разрешенному перечню значений;
0400400006;Значение элемента (атрибута) не принадлежит разрешенному диапазону значений;
0400400007;Значение элемента (атрибута) не соответствует заданному условию;
0400400008;Недопустимое (запрещенное) значение элемента (атрибута);
0400400009;В значении элемента (атрибута) используются недопустимые буквы, знаки, символы (недопустимое сочетание букв, знаков, символов);
0400400010;Нарушено контрольное соотношение показателя формы НБО;
0400400011;Нарушено условие равенства значения суммы страховых взносов по плательщику страховых взносов совокупной сумме страховых взносов по застрахованным лицам;
0400400013;Неправильно исчислена сумма страховых взносов;
0400400014;База для начисления страховых взносов на ОПС по застрахованному лицу превышает максимально допустимую;
0400400015;Неправильно исчислена сумма выплат и иных вознаграждений;
0400400016;Неправильно исчислена база для исчисления страховых взносов;
0400400017;Нарушено условие равенства значения суммы выплат и иных вознаграждений, начисленных в пользу физических лиц, по плательщику страховых взносов совокупной сумме по застрахованным лицам;
0400400018;Нарушено условие равенства значения базы для исчисления страховых взносов по плательщику страховых взносов совокупной сумме по застрахованным лицам;
0400400019;Не соблюдены требования, предъявляемые к банковской гарантии;
0400400020;Ошибка разрядности показателей, отчетность должна быть заполнена в тыс. руб.;
0400400021;Несоответствие показателей налоговой декларации контрольным соотношениям;
0400400022;База для исчисления страховых взносов в пределах предельной величины по застрахованному лицу превышает сумму выплат и иных вознаграждений;
0400400023;База для исчисления страховых взносов в пределах предельной величины по гражданско-правовым договорам по застрахованному лицу превышает базу для исчисления страховых взносов в пределах предельной величины;
0400400024;Нарушена хронология начала и(или) окончания периодов членства в крестьянском (фермерском) хозяйстве по застрахованному лицу;
0400400025;Превышение суммы банковской гарантии установленной максимальной суммы одной гарантии;
0400400026;Превышение суммы одновременно выданных гарантий установленной максимальной суммы гарантий, выданных одним банком;
0400500000;Иные ошибки;
0400500001;Обособленные подразделения, указанные в форме № 1-6-Учет, не находятся в одном муниципальном образовании;
0400500002;На территории выбранного НО ни одно из обособленных подразделений, приведенных в форме № 1-6-Учет, не расположено;
0400500003;Сведения по указанным лицам не соответствуют (отсутствуют) сведениям, имеющимся в налоговом органе;
0400500004;Значение составного элемента не соответствует определенным для него требованиям, указан недостоверный адрес;
0400500005;Представленные сведения не соответствуют сведениям, имеющимся в налоговом органе;
0400500006;"КНД=1151078 (2-НДФЛ) с отчетным периодом < 2016 направляется в качестве приложения в рамках 02ДО (Обращение), с указанием в Тексте обращения ""2-НДФЛ"" и Отчетный год, за который представляются сведения";
0400500007;Администрирование утилизационного сбора в отношении ввезенных колесных транспортных средств осуществляет Федеральная таможенная служба;
0400500008;"Сведения по строке ""КПП, указанный в соответствующей налоговой декларации (расчете)"", указанные в уведомлении об исчисленных суммах налогов, сборов, авансовых платежей по налогам, страховых взносов не соответствуют сведениям, имеющимся в налоговом органе";
0500000000;Ошибки, выявляемые при проверке по справочникам;
0500100000;Значение элемента отсутствует в справочнике;
0500100001;Значение элемента (атрибута) не найдено в заданном классификаторе (справочнике);
0500100002;Значение элемента Код налогового органа представления отчетности в файле отчётности отсутствует в классификаторе Системы обозначений налоговых органов (СОНО);
0500100003;Значение элемента файла Версия формата отсутствует в справочнике СППФД/СФНД;
0500100004;Код, состоящий из первых четырех цифр ИНН ЮЛ, не найден в СОУН;
0500100005;Код, состоящий из первых четырех цифр ИНН ФЛ, не найден в СОУН;
0500100006;Код, состоящий из первых четырех цифр КПП, не найден в СОУН;
