KOD;NAIM;
0500100007;Регистрационный номер банка /номер филиала отсутствуют в СКО;
0500100008;ИНН банка отсутствует в СКО;
0500100009;Банк не включен в перечень банков, отвечающих установленным требованиям для выдачи банковских гарантий;
0500100010;БИК не включен в справочник БИК РФ;
0500100011;CODE (SWIFT) иностранного банка имеет не соответствующую структуру;
0500100012;В документе некорректно указаны банковские реквизиты;
0500100013;Код товара отсутствует в Справочнике GTIN;
0500100014;Значение КБК отсутствует в справочнике КНД-КБК;
0500100015;Значение КБК не соответствует КНД в справочнике КНД-КБК;
0500200000;Значение элемента не определено по совокупности поисковых элементов;
0500200001;Значение элемента файла Версия формата не соответствует определённому в справочнике СППФД/СФНД;
0500200002;"Значение элемента файла Налоговый период по СППФД не соответствует периодичности представления отчётности (по КНД файла отчётности; по КНД файла отчётности и версии формата)";
0500200003;Формат с КНД KKK версии VVV действует с DDD;
0600000000;Ошибки, выявляемые при предоставлении информационных услуг налогоплательщикам в режиме ИОН offline;
0600100000;Налогоплательщиком не предоставлена в налоговый орган необходимая налоговая и бухгалтерская отчетность;
0600100001;По указанным в запросе КБК и/или КПП отсутствуют налоговые обязательства на заданную дату;
0600100002;Информация не может быть предоставлена до исполнения обязательств по представлению отчетности. (В тексте отказа указываются наименование налога, КБК, ОКАТО/ОКТМО  и срок представления.);
0600100003;Последняя представленная налогоплательщиком в налоговый орган налоговая и бухгалтерская отчетность представлена не по каналам связи.;
0600100004;За запрашиваемый период отсутствует обязанность по представлению налоговой и бухгалтерской отчётности;
0600100005;По указанным в запросе КБК, ОКАТО/ОКТМО отсутствуют данные по КРСБ за запрашиваемый период;
0600100006;По заданному КПП отсутствуют налоговые обязательства;
0600200000;Ошибки в запросе на получение информационной услуги;
0600200001;Дата запрашиваемых сведений превышает дату запроса;
0600200002;Запрашиваемый период не относится к одному календарному году;
0600200003;На дату запроса отсутствуют данные об открытии карточки ЕНС;